{
  "id": "g1g1g1g1-0000-4000-8000-000000000001",
  "name": "My Workspace Globals",
  "values": [{ "key": "region", "value": "eu", "type": "default", "enabled": true }],
  "_postman_variable_scope": "globals",
  "_postman_exported_at": "2024-05-01T10:00:00.000Z",
  "_postman_exported_using": "Postman/11.0.0"
}
