{
  "id": "e1e1e1e1-0000-4000-8000-000000000001",
  "name": "Staging",
  "values": [
    { "key": "baseUrl", "value": "https://staging.example.com", "type": "default", "enabled": true },
    { "key": "password", "value": "s3cret", "type": "secret", "enabled": true },
    { "key": "off", "value": "x", "type": "default", "enabled": false }
  ],
  "_postman_variable_scope": "environment",
  "_postman_exported_at": "2024-05-01T10:00:00.000Z",
  "_postman_exported_using": "Postman/11.0.0"
}
